Item,Sentence
2454:46,"and where we are  now, what we're doing  is some very big lawsuits that  happen  to have a heck of a lot of boxes of documents."
22799:53,"but, um, we kind of thought that maybe they just wanted  to give him some medication to sort of, you know keep him real out of it all the time"
166169:26,"i do know for a fact that some of the teachers that i know  personally get paid  an awful lot more than,"
146091:18,"um, i've done some cross stitching."
161668:20,"you actually, some catamarans you can actually pull people  behind , the skiers,"
74580:17,"that's, uh, some pretty good ideas."
30391:26,"we have, you know, used some of it for some personal things."
30872:58,"it was really, i mean the hollywood really must think there's some real dummies out there or something."
168576:39,"and, uh i can imagine that, uh, uh, for some people it would be the only form of justice in that case."
104255:44,"does it, does it offer, like band, or some of the instruments."
30987:12,but they changed some things in the movie.
141909:6,"or some things are, um, you know,"
9455:69,"well, i mean, i, i, i guess i've been in some places, you know, where the weather was just so mild , you know, places like monterey, california or, you know,"
140415:37,"um, well before we built our home we were managing some apartments that we were living in ,"
86455:28,"and you, there were some places, where people, defini-,"
112637:73,"i would like  to do that  as a, as a family and, and some t v watching."
1214:19,"i put a stop to some of them as far as the door to door, either religious groups, or people peddling products."
21123:14,"i think some of the tones of the, the daily prime time is questionable,"
22656:29,"so, we thought well, maybe there are some crab in here,"
130807:72,"and one way that we do it sort of in, in iowa  is that we can take some of our clothes to the consignment shops."
157516:9,"and in some cases if it's a long trial, the desire  of people  to get out of there and not be stuck  in there for a very long time, that people are changing their minds for the wrong reasons."
97584:19,well hopefully i can do some consulting work at home.
29227:52,"i, uh, i think we both agree there's some problems there"
95651:89,"so, i, i, uh, i, i, i feel like it should be mandatory in some professions,"
126348:16,"i guess in some cases they just consider  pickup your, your phone and, and, and not let you use your phone for a while whether you hang up on them or not."
110384:95,"but i've really noticed that there are a lot of, uh, a lot more people that  are more comfortable, at least, with some women being home and, at least in the circles i've travelled  and in the church that i go to , you know,"
164345:22,"well, i think that in some cases, it is warranted."
19474:11,they had some real fancy names for them.
31480:39,"but i would think that, um, that some guidelines could be set  up to avoid that."
78294:14,"they've had some terrible problems with hispanics,"
57998:87,"i-, if they could just cut out all the fat and, and get it lean, and start  addressing some of the other issues, i think  we could take care of everything. and quit  taking care of all these other countries all across the world, you know, who  just end up  using things against us later on anyway."
44952:36,"i mean, i'm sure you heard about some of ours."
92394:53,"i mean, there there's a little bit, because there's some of those english words that you just don't exactly know what they mean  ,"
79761:35,"and he said, um, let's give her some race horse shots."
112058:22,"i sometimes have a problem with some of the, especially more famous people who  all of a sudden are crawling out of the woodwork  to say that whatever problems they have , you know, was, was because they were abused a-, abused  as children."
155521:29,and i i've seen some of them like that too
87654:14,"i guess some of the best things i've ever had , um, i, some of them were just hors d'oeuvres, you know."
41388:61,"i think there was four or five different people, that  would call, you know, some of them, if they didn't have their addresses and all on them,"
32577:19,"next year i was planting some broccoli and, and some of those, they're called  cabbage,  cabbage loppers, or whatever."
29678:24,people say let me see some of your work.
85881:104,"i guess we're going  to have a lot of parades  this weekend in honor of these guys that  are, that  did some stuff over in the gulf."
109712:50,"but the trucks that  were supposed to do it, there's been some problems with  from what i've read  in, you know, the mail that we get"
139879:19,"well, you've got some experience behind you in the work force."
97813:26,"and, you know, maybe do some free lance type work at home."
156465:52,"i mean, it  seems absurd that people will pay, you know, some bucks just  to get someone to,"
170859:54,"uh, i've had, uh, three boys  through, i guess, uh, some child care, each one of them"
31279:10,do some things that  are totally different and unheard of.
121757:115,"if i was having a dinner party i would probably, um, have some, um, some, uh, um, some fruit to start with  with some apples sliced up and maybe some cheddar cheese and crackers and grapes and, um, probably serve maybe some wine and beer and maybe have some, uh, uh, salsa and chips  around and peanuts."
39653:15,and you can put some cucumber slices on too.
6581:42,"but i guess, they, you could put some money  aside while you were there, your expenses and,"
156671:38,"but if you could find a way to prevent some of it , and i'm not sure what it would be . it would be money better  spent than,"
63704:23,"now, okay, we run into some problems once,"
146662:13,and there are some fire stations i can take newspapers to
20307:42,i thought maybe you had come from somewhere else and had some experience with taxes there.
81221:70,"i think you have to let, yo-, you got  to segregate some of it."
95645:41,"well, i, i feel in light of some of the accidents and so forth that  have happened lately, that i think there are some occupations that they should, such as the health field, the transportation field, uh,"
146544:24,"i do think that there are some significant kinds of things to to look for  , you know, if you are faced  with placing someone. in a place like that, uh, you know, aside from the cleanliness and the medical care that  is offered  and such"
136383:15,or you been doing some remodeling work on it.
81838:54,"so it 's kind of hard at that point to, you know, classify some of the builders."
160994:25,"but there's some also some, uh, not so smart ones."
83056:37,"uh, we're probably making a comparison against, uh, some european and, uh, and, uh, uh, s-s-say, newer republics that, uh, that  have very high percentages."
97004:103,"because, uh, i, i guess i placed all but one or two of my calls. and, uh, only because i going  to make some money,"
15155:80,"i mean, and it 's nice to, to try  to teach young people some, some, uh, uh, civil, uh, consciousness,"
30504:13,and we have some education programs that he likes .
39049:23,"in the winter time i usually plant some pansies in there,"
84185:16,now i have got some daffodils.
24056:22,but i know there are some fields where it's really not necessary .
135381:35,"to me, half the time it's more fascinating than some of these made up stories."
155741:63,"i think by  putting term limitations on you could, you could slow down some of the problems."
67111:87,"and some, some of the people, uh, some of the higher dollars lawyers and stuff downtown too, are picking up some of those great big houses,"
20734:79,"they'll help you, recycle, because we, there is some bins, like behind wal-mart, that  take some things."
149904:6,"and some superficial type damage,"
118753:13,i think in some ways that  they need  to be more careful of the teachers that they hire .
117354:63,"i just still have need for the four bedrooms  just having company from time to time. and some of them coming back home and things, you know."
72832:14,there may be some schools you could read about  and learn.
129171:26,what do you feel  are some of the main problems.
56317:78,"and while that's cooking, i take mayonnaise, about a cup of mayonnaise, and a teaspoon of mustard, and some garlic powder,"
91286:72,"yet, like, say, you know, the university of small town in arkansas or something, might have some top specialists in my area."
146901:36,"because i had some appointments at the office  today, some interviews"
129083:10,they have some good management principals in this new generation.
80278:17,it's just some of those women that  come up there  looking like arnold schwarzenegger's sister just doesn't get it.
130276:4,"some people,"
15749:21,"well, now, we had some friends that  went  to see it"
63108:7,"and some of them require me to go out of town,"
95586:13,it's got some pretty strong competitors.
36621:7,but some of them are really nice
107709:28,and i think we'll probably experience some of your weather although i think they have more humidity.
138943:28,"you may get a cold snap or two or some rain or something like we've been getting  in december,"
112498:14,and save you some money too.
36613:5,some of them are pretty rough.
11767:21,"and i hope you enjoy some more good movies late-,"
38898:13,and i did some of that.
35576:25,"and i was picking up, uh, some background noise,"
114610:10,we get some killer winters up here in the mountains.
121757:169,"if i was having a dinner party i would probably, um, have some, um, some, uh, um, some fruit to start with  with some apples sliced up and maybe some cheddar cheese and crackers and grapes and, um, probably serve maybe some wine and beer and maybe have some, uh, uh, salsa and chips  around and peanuts."
1843:22,"i mean i've heard some songs that, that i just thought  were horrendous cover versions of,"
56109:69,"it 's just probably a good thing that the oil's burning and may, may, make some people realize that hey, you know, this stuff runs out."
155092:75,"well our situation is just a little bit, kind of the opposite of that cause my wife was not working for some time and was going to school and just recently, uh, took on a full time job,"
126761:25,"e-, even in some families some people talk a little bit different."
177328:13,"i've done some other things too. uh, you know."
13977:49,"i think they should either do that, or, or afford some time to the military, or, or  helping elderly people."
176960:92,"at the bottom end, they, uh, are always willing  to, uh, let in cheap labor if it lowers the cost of doing business in some particular area and has strong support from the, powerful people in that area."
55386:25,and he's had his problems with some of the old guard himself.
170740:34,because i know my grandparents wanted  to have some independence still.
38927:18,but i have recently done some cross stitch.
169939:81,"and it didn't look like, uh, you know, how, yo-, you, you walk into some rooms  and there's, it's completely generic."
126761:30,"e-, even in some families some people talk a little bit different."
156938:9,"but in some cases, yes."
31278:24,maybe there need  to be some radical changes made.
10841:72,"but, uh, uh, it, it did show some, some, uh, some interesting things about the f b i"
16319:19,go  buy me some strawberries.
75552:115,"it's kind of scary when i think of what  will happen in twenty years, you know, when i have kids and they're grown  and, uh, just kind of some of the changes that  will happen even more"
56842:9,"uh, some countries voting is obligatory."
53389:28,"i, sometimes i hear some things on, on the radio."
130958:7,but some of those are pretty big.
108790:33,"and then some of it is, some of it actually gets into some serious discussions of problems in our, in urban society."
166774:13,but there's some of the day-to-day needs that they just are not able  to deal with  physically anymore.
30001:7,"but some things, especially letters, if they suggest certain colors for letters, i just go with whatever i want  to ."
163414:55,"i guess i k-, i think it's got some relevance,"
94780:11,"and, uh some people do"
8866:65,"and that, oh, i guess, ranges anywhere from, uh, carpentry work to, um, um, some types of furniture and, um, oh, i don't know what you would call them , knickknacks, i guess, stuff you hang  on the wall  to put a mirror on"
122706:39,where they may have just had a teaching major and then had some social studies courses
111758:13,"and i had some time off in the afternoon,"
90051:29,"so, i told them he strangled on some chicken"
35130:35,"i sit, i sit and watch some shows,"
2199:135,"and they did an analysis  for us based on what we were putting  in and the time frame that we wanted  to look at , and then gave us a good idea back, you know, some good information  back on whether or not we were going  to achieve those goals, and, or not, and what we needed  to do  so that we could achieve them and the money we could put  in at what time."
72090:7,and some of them are real short
134176:70,"and we'll let them try  to drink out of some of the lakes and try  to fish in some of the lakes that  have been suffering from, uh, the, uh, acid rain"
109394:16,"but i guess some of the other smaller colleges might, might be a lot different."
47430:120,"speaking of bush, we're going  to get a little off topic but speaking of bush, they that had a story where he went  to visit some little, uh, elementary school students, and stuff ."
34149:38,"you can go down and shoot up against a sand bag and some targets and have, uh, competition."
132454:18,it beats memberships at some of these clubs.
107258:36,and i think though that we need  to have some liquid  around that you don't have  to go through the company  to get .
102016:6,and some hard-boiled eggs.
99170:29,"i, i think some of the dress codes are different at different schools."
158120:17,"like say some young kids or something like that that  might be inclined more towards a life of crime, had  to sit and watch and, and see a guy burn or, or, you know, something or shot  by a firing squad or something like that."
89068:107,"but, uh, so when you are first going to school  that, you kind of have the luxury of  being able  to have some latitude in choosing the place to go ."
131517:11,"especially in some of these schools around here, i think they have about twenty percent older students."
96870:36,"they were. i was listening to some of the comments on ra-, television  the other day, uh, about it,"
94784:6,and some people don't.
51562:11,they had some other expenses that  came up
13347:26,"well, it seems that there's some things like the, uh, the programs at least just go around and, and, and clean up streets and, and, and pick up trash and even aluminum cans and some of these kinds of things."
24192:41,"and, um, i also have a good languages background, linguistics. and some psychology."
58962:27,"ye-, you take some of the batter out and give it to someone else"
147337:25,i am sure you have got some really good nursing homes around dallas.
50706:31,it  would be great to have some of those organizations like you mentioned  that  were during the depression or coming out of the depression available for kids.
135016:25,"um, i try  to do some painting, although i'm not very good at it."
38792:27,it's a lot about spiritual warfare and some things like that.
149736:22,"and, uh, they've had some impact, but not a tremendous amount,"
13059:11,"i sold some of them,"
95345:10,"i do some p c stand alone work on it,"
97320:78,"i was rea-, i was really looking forward to summer, thinking oh, we are going  to have some time off."
42183:38,"uh, i can't remember what the town was , some little area."
45067:40,"and, okay, this, this candidate tells you some things that  are going  to happen"
7361:10,they have some nice stuff down there.
59953:42,"i wonder if a judge didn't have control of that if some of that would change, you know."
152359:98,"although he, you know, the more complex your structure  the, uh, less difficult it  is  to kind of carry some things through"
161018:14,"i mean, some people seem fairly well suited for for, uh, miniature poodles and such."
129179:18,"uh, in dallas, some of the major problems, uh,"
39025:60,"and whenever i go  visit my parents , they're always saying, well, bring some of your tapes."
66763:14,"but, um, some of these people are just out and out brutal."
127011:17,i can associate with some of the people in that movie because of the young students i see  over at the medical school.
101025:37,"but from talking to people in other districts there are some major problems, uh, with dropouts."
131523:14,i've seen some people that  are really quite up there you know
13424:16,"and in fact, some of these things i get , some of these questionnaires,"
151338:21,"uh, like i said, some industries, though, i think it'd be very necessary,"
122792:22,"well, if you play with some consistency though, you can get it right back down."
39625:37,"sliced tomatoes and then green pepper strips, just over it, and some red onion slices, and just a little bit of, um, basil, and then a little italian dressing over it."
43046:79,"it would be an interesting, it  would be even more interesting you, you to be some of these people who  are at the other end of the spectrum."
164185:22,"i, in some ways, it's almost worse than murder."
70851:34,"and, uh, so, we had  to make some adjustments"
91333:59,"um, you know, when i first was applying for graduate schools , i applied to some big programs , you know, in this area, like stevens institute of technology, which  is recognized  in the northeast as, as, you know, one step below m i t in a sense, you know,"
159281:32,"and, uh, then i had  to do some volunteer work here in tyler, texas"
4008:21,"he did, well, in some of the later movies"
4457:24,"so, there must be something to some of them."
167015:43,"and there r-, there are s-, some substantial, nasty penalties, um, if you, if businesses try  to avoid that."
67607:18,"i mean there are some people,"
55892:50,"uh, and i find ways  to, to turn some of that back to, to others ."
87190:11,"that's some of the things i think  about it,"
142780:82,"as far as the rangers are concerned , i think, i think they need some, definitely need some pitching."
2006:5,"some of it,"
163703:15,"i think some of them, the artists are even, uh, hitting the pop charts."
7282:17,"kind of gives you some space for yourself,"
157519:107,"i'd read one book, i think it was calls  trial by jury of all things, that, uh  went through and interviewed a bunch of jurors in some of the big cases, and in many cases  looking at what  had, at the evidence afterwards as to whether the decision was right, went back to the jurors, uh, based on the deliberations."
127350:66,"i've, i've heard they're, i hear you have some problems."
106267:29,i'd have  to go back through some expense reports.
143543:20,"and there are, uh, some fairly sophisticated approaches that  are used  in the high schools with point systems and things like that so that people, uh, gain a competence with respect to the material."
75025:28,"i mean we need  to redo some, rewiring ourselves"
169902:90,"i, i think sometimes, you know, i've noticed, uh, people asking for, uh, some of the patients asking for things , uh, just repetitively and, but things that  are not reasonable,"
69673:14,"they've mumblex some companies that  are doing, uh, hair tests."
42623:15,"i mean, some of these saturday night specials that these companies put  out, that  are, pie-, i mean, they're are"
169857:78,"i think i'd look for a home where they got a lot of attention  and, uh, where they did some things  to try  to keep them, um, mentally alive . and where there was, uh, caring and compassionate, where there were caring and compassionate people, uh, operating it ."
84633:31,"i mean, they are eighteen to twenty-four, some of the young men and women."
123034:17,"i know maybe some of the big things that, uh, uh,"
32942:10,they have some little buds on them
39035:20,"and they said, bring some tapes with you."
20045:19,even better than jaws and some of that.
66700:13,"you know some people on the case were, were a little hesitant on convicting him on some of the charges"
108757:10,"um, some of it, um,"
91185:45,"but some of the, uh, the small, some of the larger small schools, you know, i guess around three or four thousand students have a, can offer a broader range of curriculums and things,"
149748:21,"you know, particularly in some of the housing projects, uh, you know, that's, that tends  to be where a lot of that crime is focused"
93765:12,"so they took some time off that, uh, they could show us around."
38055:13,"and i process some ratings and put, do graphics for their television stations, mumblex their clients,"
87128:10,"there's some absolutely lovely and marvelous and peaceful areas in washington. regardless of the racial makeup,"
62717:78,"but that's one thing  to be said  for credit. it, how, it gets you some muscle where you need it  ."
44903:37,"and ma-, maybe let them have some mock, i mean uh, you know elections and stuff and vote for different people in their classes and start  really young."
22696:54,"i guess the weirdest thing i've ever caught  is, uh, in some of the inlets and the rivers around mumblex delaware."
61208:34,"and the, the ground will filter some of it but not all of it."
66700:68,"you know some people on the case were, were a little hesitant on convicting him on some of the charges"
115343:46,"i read, uh, a lot of steven king, dean r koontz, uh some danielle steel."
102998:7,"but some of the different things we're doing , uh there's just not a time, enough time to do it all"
7758:15,"but, there are some others out there that i don't believe  deserve the money they're getting ."
133518:49,"well, it went pretty well, uh, other than the fact that we encountered some, uh, problems that you run across  in older homes with plumbing, which one thing led to another ,"
142083:50,"some, uh, you know, i have some good shots and some bad shots."
45097:7,"now some people object during primaries,  having  to declare a party, whether republican or democrat"
128696:11,they have some of those in ohio.
146829:11,you see some of the stuff
121775:13,"um, maybe some rolls and, um, i guess  some, uh, some rice or something like that."
50456:132,"you know, we, we've got folks running around here who  get, who  get degrees in basket weaving and you know, underwater psychology, or some, some ridiculous stuff like that."
104342:23,"and i couldn't tell whether some parts of town had started it or if it was just everybody was, was waiting for the delivery of whatever those containers were ."
128305:9,"occasionally, some ice skating will come on, on a sunday or during the olympics"
70357:25,"and, they have, of course, some pretty severe storms, winter storms, snow and that type of thing."
144063:31,"well, th-, there were some people that, uh, that  had a problem with that. because they found out later on that, jeez, you know, a guy will lie rather than get killed ."
108856:73,"you can't understand what they're saying  on some of those songs which  probably is just as well on some of them, too."
141004:32,and then they'll get  to pick out some of those favorite snacks that they get  to pick  out
2345:21,"i, uh, have attended some seminars that  had some tapes that  went with them, but, uh, i guess not so much books although they sometimes have manuals and things,"
19745:104,"if you ever get a chance to go over to vicksburg, the battleground at vicksburg, uh, there's an area there where there was, uh, some texas, uh, groups"
133013:23,"um, and it really saved us some big money once."
11082:15,but they're predicting some more snow for our direction.
134301:16,"or, just have some wild flowers growing back there would be real pretty."
125857:6,"and some days he doesn't,"
122421:31,"uh, what, what are some of the shows that you have been able  to rent   though."
54373:11,there are some kurds living in iran.
26057:49,"well, having, having been out of the credit game for some years now, i've gotten used to  either paying in cash or not getting it."
18479:6,"and some places, they, they, they really nail them for tax."
99651:29,"well, it sounds like he's got some really, you know, good strong ideas of what he wants  to do ."
71201:52,"uh, i kn-, i'm familiar with some, some upbeat school areas,"
20722:22,i know they're doing some curbside recycling as a kind of a test there.
42470:35,"but somewhere we've got  to come up with some money to build,  to build more, you know, and keep these people in them, you know."
105485:20,"but, uh, we did some water skiing , of course, and, and, uh, driving around the lake in the boat"
168607:32,"and i thin-, there's also some, uh, i think, uh, poorer lifestyles illustrated but simply because it dominates so much discussionary time."
52983:20,"i know there are some good places to go  camping  along the, uh, the lakes."
51876:10,you get some kids in there
158476:38,"but they also did, they also did some of the teaching things"
99247:72,"i think the elementary school teachers, or maybe even the middle school teachers dress a little fancier than, than some of the high school teachers, i think."
6396:60,"and then i think there's, i mean i think there's some negatives,"
17721:21,"i've, uh, had some health problems that  have led me to, uh,"
65910:42,i would like  to be a little more into investigating some of the other countries in the world and their educational problems. and to come up with something a little better than what we've got .
77759:32,but i think it would be nice if some of the parents would be around for a few more hours.
66134:57,"i, uh, i'm trying my best right now  to pay off some of mine."
16212:24,"i was going  to make some, uh, like fish chunks and dip it in the fondue."
