Item,Sentence
113855:35,"and i don't mind, uh,  paying for some of these fringe benefits that people are entitled to ."
62647:7,in some ways it has more  to do with the people who  sold it.
29410:26,"and, and they shed some light on what  was going on for me."
51582:32,"and, um, it had been recommended  by some friends of ours"
80681:23,and i've been  buying some magazines and stuff and looking at different ways to paint .
29180:50,"then it comes down to what you said  before though about them being some of the lowest paid public, you know, public service, employees that there are ,"
44939:18,and people are finally taking some action against it.
152280:24,"i mean, you know, some people had been there a long time."
133228:13,i certainly have some ideas since i'm studying it now in college.
38919:40,"i've, i've, uh, made some small things, cross stitch things."
55078:22,in a way aikman has done some of that.
145692:12,and they took some rooms down at a holiday inn
91041:57,"but, then again, uh, well, i, you know, i have some aunts that, uh, i, i, i do ."
165687:30,"and i found that while you can find some cars that  are comfortable to ride in , uh, finding a ca-, car  anymore that 's, that 's fairly easy for me to work on , it's just not very eas-, it's not very,"
164091:22,"and it's, uh, got some nice features in terms of being able  to remove seats and flip them around"
146619:59,"and they they just didn't like participate together with the others because they had some some, uh, i guess, uh, slight mental disabilities and things like that."
76377:93,"if they have problems with, uh, sand bugs of some kind i think  all they need  to do  is probably  put some insecticide down in there on a, oh, a fairly regular basis, for a while anyway."
96882:42,"but i just would rather have, uh, a man  doing some of these jobs than a woman."
177105:58,"uh, uh, they've, uh, looked at, uh, plutonium and uranium and, uh, some other similar things  to try  to remove those from radio active waste"
29208:96,"goodness gracious, if we would, uh, plan our expressways a little better, that ten dollars for the bridges and the roads, we'd cut that in half and get some teachers"
51340:81,"you know, i kind of wish that they had inter league play, like they do in all the other sports so i could see some of the national league teams here once in a while."
171678:13,they've had some serious problems in the past couple of years.
62101:38,and just recently i've changed my job to actually do some of the marketing.
27683:75,"but the, the interesting thing is that paint we wound up  having  to go back and scrape some of that away"
155563:20,"uh, guy, uh, some of my things, i, i'd like  to have a short work week you know,"
166903:55,"matter of fact, i've heard that, i've heard that some of the information , uh, is prevented  from  reaching the jury, like, uh, mitigating circumstances or, or preceding, uh, criminal record or things of this nature that,"
49908:42,and every once in a while gets a chance to talk to some of the guys
27803:45,"uh, and i think even electric light orchestra had some, some real, um, influences by classical music"
159358:7,and some of the really nice ones that  really take care of their people are so expensive. because cause they can afford  to hire the people that  are really going to care for the older.
26735:64,"and, and that way,  handling it that way they could probably get some results out of it."
87257:107,"and they were just really coming down on him because of some of the things he was, just some of the things that he believed in , some of his morals."
71184:87,"so tho-, those are two areas in which t i stands  to, to gain some, some short term business  to restock that ."
38978:27,and i thought i better  do some simple things and work up to this because it  was just so difficult to get it done .
62192:35,"but i've, i've got some opinions on it."
155746:10,"i know some senators,"
19045:21,"and i've seen where some places have taken a plastic  and, uh, they're recycling them into other plastics. and the styrofoam also into insulation and things like that"
22657:23,we'll try  to catch some crab.
117808:33,"and, uh,  seeing as you've got some older children, i, i'm wondering, how did you handle that , when they were growing up ."
46373:50,"sometimes when you lose someone that you really love  , you do some crazy things"
134176:40,"and we'll let them try  to drink out of some of the lakes and try  to fish in some of the lakes that  have been suffering from, uh, the, uh, acid rain"
62581:54,"well, we bought a computer because my husband needed  to use it to do some work for a consulting project,"
46609:15,"and especially not in some of these big cities,"
159138:19,"and, uh, granted some people need  to be compensated  if they have really been wronged , you know."
165858:16,"some, some local communities are very active in that, uh, in that respect"
108737:78,"and, uh, a lot of it is, has a lot  to say , or some of it has a lot  to say ,"
141287:39,"there is one cousin out in colorado, uh, uh, some cousins over in phoenix, uh,"
25273:85,"well, um, oh, i guess another thing i've noticed , too, here lately is that even though we've had some pretty warm days, it's been awfully gray, you know, just,"
109067:18,"marinated in olive oil and some seasoning, um, and cooked with some olives and some, and some prunes, uh,"
46446:10,"uh, some of those countries were so safe, it was unreal."
55919:15,"it gave some folks some jobs,"
120922:61,"but by then, of course, i was able  to catch, uh, catch some things,"
94182:13,must be some italian spices in there.
65357:5,"some of those books are real tough to get into ,"
166453:10,that's some brutal stuff there.
83497:27,"plus, i guess, there was some credit for time this guy had already spent in jail waiting for trial ."
27330:65,"i remembering  reading a few cases about that when it, when some people first tried that"
124653:71,"it's hurting, you know, it's hurting germany , for example, too, and some other parts of europe where they, where they have high industry ."
79030:34,"they have  to kind of take a stand on some things, like abortion and things like that,"
88662:24,ours really needs  to have some work done  on it
147291:12,"and they needed some quality care,"
168982:36,"and, you know, for some, for some young men, that's good."
99158:38,"but, you don't know, uh, i guess at some of the other schools you go to  unless you've been there."
60662:8,"but some of the internal news and the news services,"
174570:7,in some ways i don't like it because it's like they're playing god.
12596:58,"i mean, i'd like  to see them resolve something in that situation and get some stability in the region"
19295:81,"well, this would be like if somebody was elected  president of the united states and suddenly took off toward, you know, just some pretty hard by the socialism,"
37349:44,"i, well i see, i think  some people wanting  to stay home more and take care of the children."
90039:83,"and, uh, they brought in a very elderly man from a nursing home who  had, had, uh, apparently inhaled some chicken he was eating ."
119945:93,"and i think that certainly makes a difference from, back from the time when somebody handcrafted something  and, you know, had some pride in it ."
76200:18,"they, uh, auctioned some tools and, things like that,"
4528:7,and some of them fizzled out
109269:7,"well some schools may even give you financial aid, where another one won't ."
171919:19,"we do some cooking, some barbecueing, have a few drinks and then go in and see the game and see the patriots lose and then go home and eat, drink some more."
106619:25,"and the second one was i bought some toys at a, um, at a craft fair."
64610:17,"and they've built some new highways out to that area, and things, lately."
109067:39,"marinated in olive oil and some seasoning, um, and cooked with some olives and some, and some prunes, uh,"
168555:17,"like i said, some years ago, i think i would have said there's no place for capital punishment in the, civilized western country."
151108:23,"it was, yeah, in some of the critical things, like the off-, special investigations, at one time in one of the cases had videotaped this person,"
53602:9,"uh, some real massive thunderstorms."
146225:40,"so i had, i went and bought just some cloth glue and glued it all back"
148889:35,"got that, uh, uh, some insight  there,  to, to kind of help me put together the feelings."
15068:10,compared to some of the other ones.
27799:10,"chicago had some things,"
13424:44,"and in fact, some of these things i get , some of these questionnaires,"
143722:15,"but i know some people can get, get, you know, carried  away with them and let them get out of hand."
33859:9,"there some things i'd like  to try ,"
156639:7,"but some of them have already been in youth centers. and that kind of thing,"
91758:36,"and he really, this man really shed some light on, um, some, aspects of of bach's genius and, and, and, you know, the, and more sociological things, you know, like the, the idea that, um, that music, to be a musician was as much, um, of a family occupation as anything."
82295:13,"they were doing some, uh, ozone testing, and, uh, th-, the e p a"
171693:31,"and it recently was sold  to, uh, some other people"
73140:10,"and then some of them add late fees on it, if they don't get paid"
72160:27,"just to do, you know, some bicep, tricep exercises."
135551:31,"so she couldn't possibly turn them out like some of these popular writers,"
155436:87,"if my parents were  to get ill, i would like  to take care of them at home and if i had the money with some help."
31180:170,"and, uh, you know, i, i've, in hindsight, seen some things that i wished that, you know, i had done something about  that  was, you know, within my power or, uh, you know, wish that in some ways we, as parents, had more control over what 's happening up there, you know, type thing."
90848:29,"and it was not only in mississippi, in some other places, as well,"
22932:13,now there is some really nice ones.
94526:45,"and we found that if it's in a certain part of texas, some people come,"
127169:7,"and some of these mini skirts, you know, are worse than shorts ever thought about  being."
48532:18,"once you get into some of the programs that  are out now, you can do so much  with them, that you don't do  until you really make yourself use them."
6397:25,"but there's going  to be some negatives anywhere, you know, no matter where you go ."
23861:102,"and if you like chinese food, you can take filet of fish and put a little bit of soy sauce and a little bit of sesame oil on top of it and chop some scallions and a little ginger and just cover it with some, uh, waxed paper and steam it just until the fish is done,"
10895:45,"well as, it, as i recall it got some academy awards, didn't it."
91758:53,"and he really, this man really shed some light on, um, some, aspects of of bach's genius and, and, and, you know, the, and more sociological things, you know, like the, the idea that, um, that music, to be a musician was as much, um, of a family occupation as anything."
138037:56,"i think we need  to get back to the, show some respect"
176628:53,"i i built it  two levels and with a big toy box and some benches and, uh, a backrest and all that stuff."
95400:23,"um, well, i actually do some work,  working at m i t and at nist, national institute of standards and technology in washington,"
9584:73,"when i, when i started  thinking about this , that those are some of my favorite shows,"
64564:10,they have some pretty nice weather out there in los angeles.
50235:53,"and, and, and i don't have any doubt that through some back channels that we encouraged it. you know."
142141:14,"i have got some of those too,"
37283:73,"but, uh, even now, i would, i would like  to not have  to work in some ways."
43642:11,what are some other ones i've seen  lately .
77358:19,"and, um, did some shopping and stuff."
108972:69,"and it consisted of, of grilled kielbasa sausage uh, a potato salad with olive oil, and uh, some tomatoes that  had been chopped  up with onions and curry powder"
164404:48,"but, then, you know, i think that, that some murderers don't really warrant capital punishment. you know, just, like, for example, uh, you know, you hear about cases where women have killed their husbands who  abused them"
100571:7,"and some of them, i think  unconsciously do it, you know, as a just, you know, half seni-,"
94747:14,there have been some really wild shows put on there.
146612:75,"well, it is like, wel-, the one that i worked in , uh, you would see some of them just like in wheelchairs all day,"
55919:10,"it gave some folks some jobs,"
8930:19,"so, those things they take some time to make ."
147582:28,"and it 's just too bad that some people, you know, still look down on them just because of their color. you know."
92716:8,"just some of the times they're continued ,"
104230:49,"it's kind of haunting, you know, on, on some of the notes."
115742:25,"i, i do some things."
96261:16,and i can take some real great tours to europe.
118309:83,"that's, y-, count your blessings because uh, it really is good when someone can do some things to a car themselves ."
83449:32,"uh, i know in some cases now in some states, depending on the criminal code, uh, a unanimous verdict is not required ."
2767:14,"i've done some of the other speech programs,"
134101:49,"uh, the state of wisconsin, as a matter of fact, uh, started some litigation against illinois because of the air pollution we were getting ."
81929:47,"an, and while, while there are some advantages to that, there's less time spent outside making it look nice and taking care of things."
149485:72,"and especially in this election year, i think that, uh, there ought  to be so-, at least some conversation about what we are supposed  to do  about this."
13411:17,"and that is that some of the organizations sell their mailing lists which i think  is a, is an invasion of privacy."
110398:27,"i found when i did do some work  when my son was young , it was like contract work,"
32577:41,"next year i was planting some broccoli and, and some of those, they're called  cabbage,  cabbage loppers, or whatever."
83198:48,"if you don't refute it, as he didn't, there must be some truth to the matter, see."
74301:11,"i see some flickers of, of, uh, of good directions turning,"
9608:21,he took a car battery and some wire and two washers one time and made a welder.
160993:10,"there are some smart ones out there,"
140815:71,"you know, maybe you nee-, you can get it signed  up this spring or summer for some of the dog obedience classes."
31489:41,"on the other hand, um, i think there's certainly some professions that  ought  to be tested  because of the, of their responsibility for the public welfare, and certainly people in, uh, industries, well, the transportation industry, for spe-, uh, you know, specifically."
43407:11,i know some friends who  went  to see it.
161619:23,i'd like  to do some sailing.
121023:37,"saint augustine, uh with a little bermuda mixed in in some of the sunny areas"
113475:14,"we drive by some houses  everyday that  have big signs,"
31254:36,and i would imagine their learning disabilities are quite large in some cases.
108975:9,and probably some yogurt was in there.
74324:8,"and, some people just don't have it."
171296:110,"but, the thing is too, maybe they need more of a, i don't know, more of a expert types to, to be on some of these jury cases because most time you just pick, you know, joe blow or whoever and a good citizen or whoever an-, and call them in."
129004:16,"but, did they have some pretty good special effects."
55311:27,"but on a highly populated area, like some of the soviet cities would be, with the weaponry that 's attached  on those things, there is no place to hide ."
136180:24,"i mean, we still have some highways closed ,"
31917:13,"and we made some really nice christmas wreaths with, uh, dried red flowers and dried white flowers and, uh, eucalyptus."
73173:67,"so, they've got quite a bit more motivation i think  to get paid  then, some of the others do."
142828:81,"and i think you're probably right, that they, that they need some, you know, some changes in, uh, pitching coach, maybe"
19999:14,"um, well, some history, books are pretty scary,"
99236:8,"because some of the teachers i know  wear, uh, dress up jeans, not sloppy looking jeans but tapered jeans that they've had  dry cleaned  so they have got the crease"
14637:17,"and then they're some sections kind of in the corner areas,"
49551:24,"and it had some, some nice features."
16318:47,"and they, they mumblex they go  melt some chocolate chips,."
80333:17,"you know, how some older women will get the big bulge right in the middle ."
90230:11,"he had some accomplices that  were kind of suspect,"
156650:7,"and some of them are our problems,"
7285:11,i made some afghans and that kind of stuff.
136539:14,"i mean, some nights it's just real, real quiet."
115490:21,"and even like reading some new age things, things that i don't quite believe in ,"
67466:21,they want  to put some equipment on their bike and go for a tour.
73538:38,"i think that might be part of the problem with some people. you know,"
80218:50,"and i, when i'd gotten back  i had gotten some sun that day,"
89180:32,"i, i was involved in some, uh, oh, alumnae recruiting, uh, here in town, uh, recently, uh, well last year."
6607:30,"because from what i understand , from some of the guys i know , you know, crime, uh, is punishable, just almost, uh, instantly and public,"
2180:39,"so we have, both of us have some money in an i r a that we're also trying  to figure ,"
138349:36,"but i kind of, i liked it some ways"
57069:61,"and, uh, he makes a very, uh, passionate, good argument for why you don't want some things decided  by democratic process ,"
167037:72,"uh, but, if that's the case, if the business is responsible for  policing themselves, then i think some well defined mechanisms need  to be in place so that, uh, the opportunity f-, to forget that you owe sales tax for something, uh, can be avoided ."
15021:56,"i've, i've talked to some who 's really had some bad experience"
136110:19,i think he has some interesting things on it.
37846:61,"not if you can read or write, or do, or un-, understand some science."
84152:34,so i just cut the leaves off and transplant and put some other plants down. because i want them to come back up next year.
156896:23,"i think i've seen some statistics that  say that, uh, it 's more expensive  to kill somebody than to keep them in prison for life."
23994:24,use the same hoi sin sauce and some of the frozen mixed vegetables.
152067:34,"unless you, unless you have some vacation time or some, some sick leave or whatever, um, you kind of have  to finagle your way around  to get that time."
105043:10,"i got some good recipes from them sometimes,"
96042:48,"i mean it was, it was just almost laughable in some instances that, you know,"
126455:10,"uh, some of that unfortunately is legal."
172225:11,"i have some games , of course, which i play  on there"
63417:44,and i think they're working on  building a jogging track and some other things.
137794:5,some of these muddy driveways could use it around here.
99291:5,"some of those male coaches, that might really,"
39753:27,"cause, we have some, some local ones."
130514:28,"and i mostly went to germany and visited some friends of my family and, uh, hung out with them, worked a bit on one of their farms and also went to a youth camp."
164352:16,i think in some cases it  doesn't matter if it's a deterrent or not.
56072:31,"and they, they've started some recycling campaigns that  a year before that had been turned down  because they said, well, it's not feasible,"
119842:10,"we bought some walkie-talkies a couple of years ago for christmas,"
157934:65,"well, i do think with working parents it is, i mean, there are some real issues here. um, that i think, um,"
14969:24,i guess i've had some good experience and some bad experience with them.
145536:63,"i, in fact, i've, i've even, uh, heard some people that  have applied for credit cards with much less, uh rates and have paid off their, you know higher interest rate, uh cards and just sent them back, you know."
24962:14,"in, uh, some places, uh, you couldn't go to a public school."
146198:134,"well, one thing that i like  about this fabric painting thing is i can just make a t shirt and put a little ruffle around it and then, um, cut out a little pattern  from the material, from some material, like flowers or something, and make, um, a design or, you know, a little arrangement or something on the shirt and, you know, fuse it on with heat and bond, or whatever and then paint around it."
123419:8,and some paper or something in the super dome up in the roof caught on fire.
120455:28,"and they had, uh, some names, some companies that  sold mustang parts,"
92861:25,"and i guess maybe there are some parts of that,"
84205:26,"the blooms  are, on some of them is yellow, purple, white. just all different colors."
27780:99,"but when i do play, uh, and begin  to reacquire skills  i inevitably fall in love with country western music which  tends  to be in some ways easy to play  for a, for a new piano player."
112989:20,"but, but some people don't have a choice."
134228:135,"but, i, um, tend to all the, planting the annuals and, and the spraying and, um,  taking care of them and maybe putting flowers in, you know, throughout that season, and later on maybe planting some mums and that kind of stuff and, um, any kind of decorating for the holidays, you know,"
155148:17,we could talk about some of the long range goals
77309:26,"what do you think  are some current trends in, uh, the way families spend time together , based on what you've seen ."
158550:31,"and it must have reflected, uh, uh, some awful good, uh, diplomacy on the part of the u s."
78394:33,"i've become very aware of different political views because some of the things we have  to discuss  are very politically motivated or whatever,"
108182:40,i guess you have  to take some things and leave some things.
168217:7,"and some of it, sometimes it's serious"
57861:27,"um, looking back, like maybe some of the things that i know  now, i, i'm not sure i do believe it was worth the cost in dollars and lives."
88001:41,"that would provide, uh, possibly some relief there to utilize some of the property taxes for other things, see."
149669:184,"um, what  really bothers me is it just seems like if, if anyone were  to say, you know, well i'm going  to raise taxes and cut the budget and we're mumblex, we're going  to have  to do some unpopular things, i mean, he wouldn't have a chance of getting elected ."
73755:84,"people are being a little more, oh, i don't know, a little le-, a little less bigoted in some ways,"
113957:66,"man our cr-, our, uh, prisons are so crowded that, uh, they can commit some pretty serious crimes and be set  free within a year to two."
35674:29,and so she's going  to get some money for that and take some money from the bank and then try  to make as much down payment as possible  to keep the monthly payment low.
134169:64,"maybe to you and i who  have grown up in some in, uh, uh, some more beautiful parts of the country, uh, i think that, that, uh, we become a little more aware , uh, rather quickly of, of what 's happening with air pollution and how, uh, how horrible it really is ."
164073:37,"and we weren't aware of it, and just slipped on some black ice and went into another car,"
165280:27,well it sounds like you've had some good experiences with that
106437:19,but i think that at some times it can be the right thing to do
14653:39,"and i went because my dad can usually get a hold of some free tickets, because a lot of those doctors have season tickets,"
169898:50,"do you think that in the case of the one that you've actually had some experience with , that the people who  operate it seem  to have, what you'd perceive of  as genuine concern."
166634:38,"oh, here's  an easy way to make some money ."
98932:25,"that, those are some important points."
166971:48,"um, s-, s-, naturally some, some things you just can't find  in your local k-mart or, or, uh, bryn mawr stereo dealer."
6395:54,"well, you know, t i, you know, t i offers some good stuff"
24421:69,"and it, and if it's possible even get some experience at it or at least watch some people do it."
30438:27,"and, you know, it's got some stuff on it."
165750:14,"i've driven some, uh, tauruses  over the last couple of years when i've been on business trips . uh, as rental cars."
46244:16,"some, some places do have guard gates that you have  to get through , or electronic access gates and things like that."
15261:95,"i think that maybe that's why some people do it  is, uh, to see the other cultures or, you know and some of that."
89580:13,and i enjoy some of the michael j. fox movies.
137317:74,"do they still have the, uh, the scenic, uh, roadways that  cut through the center of some of those trees."
3226:17,"like, give me some examples."
94280:31,"for all the inside parts you brown hamburger and put some, um, tomato sauce in it,"
96724:27,"so, there are some, some strides  to be made  there."
171931:87,"that you miss   sitting home in your parlor, you know, uh, with, with a six pack of beer and some, uh, potato chips, you know"
48103:10,they need some attention.
38063:54,"it's basically just data entry and running, you know, some, some software"
29177:102,"they need  to put some sternness back into the, into the teachers and let them be able  to, uh, get the old whip out and get some discipline."
40705:25,"we all need that time, just some quiet time  to wind down from the day ."
